{
  "$schema": "https://json-schema.org/draft/2020-12/schema",
  "$id": "https://example.invalid/schemas/wc-binding-1.json",
  "title": "Web component binding",
  "description": "Framework-specific binding for wc. The semantic root element is declared once in packages/platform-web/components.json. A WC host tag is derived from component identity, independently of the semantic root.",
  "type": "object",
  "additionalProperties": false,
  "required": ["component", "contract", "framework"],
  "properties": {
    "$schema": {
      "type": "string"
    },
    "component": {
      "type": "string",
      "pattern": "^[A-Z][A-Za-z0-9]*$",
      "description": "Must match the contract's `component` and the file name. The custom element's TAG is derived from it — `TabItem` becomes `<weave-tab-item>` — rather than stored, because a tag that disagreed with the component name would be a second name for one thing."
    },
    "contract": {
      "type": "string",
      "description": "Relative path to the agnostic contract this realises."
    },
    "framework": {
      "const": "wc",
      "description": "Named explicitly so a directory can hold more than one binding without ambiguity. `wc` rather than `web-components`, to match the package name."
    },
    "delegatesFocus": {
      "type": "boolean",
      "description": "Whether the shadow root is attached with `delegatesFocus: true`, so focus landing on the host is forwarded to the first focusable node inside it.\n\nTHE FIRST BINDING FIELD IN THIS REPO THAT IS A PLATFORM FEATURE RATHER THAN A WORKAROUND FOR ONE. React's binding carries `refTarget` and says outright that it exists because React has no `delegatesFocus`; Angular reaches the host with `inject(ElementRef)`. Here the platform supplies it directly.\n\nOmitted means: derived from the contract's `semantics.focusable`. Present means the contract's answer was overridden, and `notes` must say why."
    },
    "propOverrides": {
      "type": "object",
      "description": "Where a contract axis is exposed under a different attribute name, because the platform already owns the canonical one. Keyed by axis name.",
      "propertyNames": {
        "pattern": "^[a-z][a-zA-Z0-9]*$"
      },
      "additionalProperties": {
        "type": "object",
        "additionalProperties": false,
        "required": ["prop", "reason"],
        "properties": {
          "prop": {
            "type": "string"
          },
          "reason": {
            "type": "string",
            "description": "Required. A rename with no reason is drift with paperwork."
          }
        }
      }
    },
    "notes": {
      "type": "array",
      "items": {
        "type": "string"
      }
    }
  }
}
