{
  "$schema": "./binding.schema.json",
  "component": "Button",
  "contract": "../../contracts/components/Button/Button.contract.json",
  "framework": "wc",
  "notes": [
    "Renders <button part=\"root\" type=\"button\"> inside a shadow root. A consumer writes <weave-button hierarchy=\"primary\">."
  ]
}
